{
  "schemaVersion": "1.0.0",
  "host": "stampede2.tacc.xsede.org",
  "name": "tacc-xsede-stampede2",
  "description": "WIP: Sample resource for TACC Stampede2 Cluster",
  "computeResources": [
    {
      "schedulerType": "BATCH",
      "connections": [
        {
          "connectionProtocol": "SSH",
          "securityProtocol": "SSHKEYS",
          "port": 22
        },
        {
          "connectionProtocol": "SSH",
          "securityProtocol": "PASSWORDS",
          "port": 22
        }
      ],
      "batchSystem": {
        "jobManager": "SLURM",
        "commandPaths": [
          {
            "name": "SUBMISSION",
            "path": "/bin/sbatch"
          }
        ],
        "partitions": [
          {
            "name": "normal",
            "totalNodes": 256,
            "nodeHardware": {
              "cpuType": "KNL CPUs @ 1.40GHz",
              "cpuCount": 68,
              "memoryType": "DDR4",
              "memorySize": "96 GB"
            }
          }
        ],
        "executionCommands" : [
          {
            "commandType" : "mpi",
            "commandPrefix" : "ibrun",
            "moduleDependencies" : ["intel/17.0.4", "impi/17.0.3"]
          }
        ]
      }
    },
    {
      "schedulerType": "FORK",
      "connections": [
        {
          "connectionProtocol": "SSH",
          "securityProtocol": "SSHKEYS",
          "port": 22
        },
        {
          "connectionProtocol": "SSH",
          "securityProtocol": "PASSWORDS",
          "port": 22
        }
      ],
      "forkSystem": {
        "systemType": "LINUX"
      }
    }
  ],
  "storageResources": [
    {
      "storageType": "POSIX",
      "connections": [
        {
          "connectionProtocol": "SSH",
          "securityProtocol": "SSHKEYS",
          "port": 22
        }
      ],
      "fileSystems": [
        {
          "homeDir": "/home1",
          "scratchDir": "/scratch",
          "workDir": "/work"
        }
      ]
    }
  ]
}
