{
    "schemaVersion": "1.0.0",
    "name": "SCIGAP Development Storage",
    "host": "pgadev.scigap.org",
    "description": "POSIX storage server for the SCIGAP development environment.",
    "storageResources": [{
      "storageType": "POSIX",
      "connections": [{
          "connectionProtocol": "SSH",
          "securityProtocol": "SSHKEYS",
          "port": 22
    }],
      "fileSystems":
        [{
          "rootDir": "/"
        }]
    }]
}